{
  "schema_version": "1.1.0",
  "catalog_id": "catalog:short-horizon-market-mechanisms",
  "catalog_version": "1.1.0",
  "title": "Literature-backed mechanisms for intraday and short swing idea generation",
  "scope": {
    "holding_horizons": [
      "SUB_SECOND",
      "SECONDS",
      "MINUTES",
      "HOURS",
      "SESSION",
      "ONE_TO_FIVE_DAYS"
    ],
    "out_of_scope": [
      "Strategic portfolio allocation and long-horizon asset pricing",
      "Buy-and-hold investment theses",
      "Monthly or annual factor portfolios without a short-horizon transmission mechanism",
      "News sentiment as a standalone signal"
    ]
  },
  "mechanisms": [
    {
      "mechanism_id": "mechanism:order-flow-imbalance",
      "mechanism_version": "1.0.0",
      "entry_origin": {
        "origin_kind": "LITERATURE_SYNTHESIS",
        "origin_refs": [
          "source:cont-kukanov-stoikov-2014",
          "source:gould-bonart-2016"
        ],
        "origin_summary": "Seeded from primary short-horizon order-book research before any internal observation was admitted.",
        "captured_at": "2026-08-31T00:00:00Z"
      },
      "title": "Order-flow imbalance relative to displayed depth",
      "generation_modes": [
        "MICROSTRUCTURE_STATE",
        "LITERATURE_REPLICATION",
        "OBSERVATION_DRIVEN"
      ],
      "mechanism_family": "Limit-order-book liquidity",
      "mechanism_summary": "Over short intervals, additions, cancellations and aggressive executions alter the balance of supplied liquidity; the price response depends on imbalance relative to depth.",
      "market_scopes": [
        "EQUITIES",
        "FUTURES",
        "FX",
        "CRYPTO_SPOT",
        "CRYPTO_PERPETUAL"
      ],
      "natural_horizons": [
        "SUB_SECOND",
        "SECONDS",
        "MINUTES"
      ],
      "actors": [
        "Aggressive liquidity takers",
        "Passive liquidity providers"
      ],
      "constraints_or_rules": [],
      "expected_actions": [
        "Consume, cancel, replenish or reprice displayed liquidity as imbalance changes"
      ],
      "observable_signatures": [
        {
          "signature_id": "signature:ofi-depth-normalized",
          "observable_kind": "ORDER_BOOK",
          "statement": "Signed order-flow imbalance normalized by contemporaneous displayed depth"
        },
        {
          "signature_id": "signature:queue-imbalance",
          "observable_kind": "ORDER_BOOK",
          "statement": "Persistent imbalance between best bid and ask queues before the next mid-price change"
        }
      ],
      "phases": [
        {
          "phase": "ACTIVE",
          "trigger": "Depth-normalized order-flow imbalance becomes extreme",
          "expected_response": "The next short-horizon mid-price change is more likely in the direction of the imbalance",
          "horizon": "SECONDS"
        },
        {
          "phase": "ABSORPTION",
          "trigger": "Extreme signed flow persists while the mid-price barely moves",
          "expected_response": "Passive replenishment or hidden liquidity absorbs the flow and changes the subsequent response path",
          "horizon": "MINUTES"
        },
        {
          "phase": "EXHAUSTION",
          "trigger": "Previously persistent imbalance decays or reverses",
          "expected_response": "Continuation weakens or the price partially retraces as pressure ends",
          "horizon": "MINUTES"
        }
      ],
      "alternative_observables": [
        {
          "observable": "Replenishment rate at the depleted best quote",
          "hypothesis_prompt": "Test whether replenishment, rather than price direction, identifies absorption and predicts whether the next imbalance produces continuation."
        }
      ],
      "violation_hypotheses": [
        "A missing price response despite extreme imbalance may reveal hidden or rapidly replenished liquidity; exhaustion of that absorber may predict a delayed move."
      ],
      "connection_tags": [
        "tag:liquidity-absorption",
        "tag:short-horizon-flow",
        "tag:price-discovery"
      ],
      "literature_sources": [
        {
          "source_id": "source:cont-kukanov-stoikov-2014",
          "source_type": "PEER_REVIEWED",
          "citation": "Cont, Kukanov and Stoikov (2014), The Price Impact of Order Book Events, Journal of Financial Econometrics 12(1), 47-88.",
          "url": "https://doi.org/10.1093/jjfinec/nbt003",
          "supports": "Short-interval price changes are strongly related to order-flow imbalance, with impact inversely related to depth."
        },
        {
          "source_id": "source:gould-bonart-2016",
          "source_type": "WORKING_PAPER",
          "citation": "Gould and Bonart (2016), Queue Imbalance as a One-Tick-Ahead Price Predictor.",
          "url": "https://arxiv.org/abs/1512.03492",
          "supports": "Queue imbalance contains information about the direction of the next mid-price movement, particularly for large-tick stocks."
        }
      ]
    },
    {
      "mechanism_id": "mechanism:metaorder-splitting",
      "mechanism_version": "1.0.0",
      "entry_origin": {
        "origin_kind": "LITERATURE_SYNTHESIS",
        "origin_refs": [
          "source:moro-et-al-2009"
        ],
        "origin_summary": "Seeded from empirical research on hidden-order execution profiles.",
        "captured_at": "2026-08-31T00:00:00Z"
      },
      "title": "Incremental execution of large hidden orders",
      "generation_modes": [
        "CONSTRAINT_FIRST",
        "MICROSTRUCTURE_STATE",
        "LITERATURE_REPLICATION"
      ],
      "mechanism_family": "Execution algorithms and metaorders",
      "mechanism_summary": "A large parent order cannot be executed immediately without excessive impact, so it is split into a persistent sequence of child orders whose impact grows during execution and partially reverts afterward.",
      "market_scopes": [
        "EQUITIES",
        "FUTURES",
        "CRYPTO_SPOT",
        "CRYPTO_PERPETUAL"
      ],
      "natural_horizons": [
        "MINUTES",
        "HOURS",
        "SESSION"
      ],
      "actors": [
        "Institutional investors",
        "Execution algorithms"
      ],
      "constraints_or_rules": [
        "A large desired position change must be spread across time to limit impact and information leakage"
      ],
      "expected_actions": [
        "Submit correlated same-sign child orders at a participation rate linked to market activity"
      ],
      "observable_signatures": [
        {
          "signature_id": "signature:persistent-signed-flow",
          "observable_kind": "TRADE_FLOW",
          "statement": "Persistent same-sign trade flow and autocorrelated initiator direction"
        },
        {
          "signature_id": "signature:concave-impact-path",
          "observable_kind": "PRICE",
          "statement": "Concave price impact that grows while the inferred execution remains active"
        }
      ],
      "phases": [
        {
          "phase": "ACTIVE",
          "trigger": "A persistent same-sign flow episode begins",
          "expected_response": "Price impact continues in the direction of the inferred parent order while participation remains elevated",
          "horizon": "HOURS"
        },
        {
          "phase": "EXHAUSTION",
          "trigger": "Same-sign persistence and participation fall toward baseline",
          "expected_response": "Directional impact stops accumulating as the inferred parent order completes",
          "horizon": "MINUTES"
        },
        {
          "phase": "UNWIND",
          "trigger": "The inferred metaorder ends",
          "expected_response": "A temporary component of peak impact partially reverts",
          "horizon": "HOURS"
        }
      ],
      "alternative_observables": [
        {
          "observable": "Participation rate and child-order timing rather than repeated identical print size",
          "hypothesis_prompt": "Test whether persistent participation relative to market volume is a better footprint than exact periodicity or block-size repetition."
        }
      ],
      "violation_hypotheses": [
        "Persistent same-sign flow without impact may indicate strategic passive execution or a competing metaorder; the eventual imbalance of participation rates may be the tradable state."
      ],
      "connection_tags": [
        "tag:short-horizon-flow",
        "tag:liquidity-absorption",
        "tag:scheduled-volume-profile"
      ],
      "literature_sources": [
        {
          "source_id": "source:moro-et-al-2009",
          "source_type": "PEER_REVIEWED",
          "citation": "Moro et al. (2009), Market impact and trading profile of hidden orders in stock markets, Physical Review E 80, 066102.",
          "url": "https://doi.org/10.1103/PhysRevE.80.066102",
          "supports": "Reconstructed hidden orders are executed incrementally; impact grows during execution and partially reverts after completion."
        }
      ]
    },
    {
      "mechanism_id": "mechanism:intermediary-inventory-pressure",
      "mechanism_version": "1.0.0",
      "entry_origin": {
        "origin_kind": "LITERATURE_SYNTHESIS",
        "origin_refs": [
          "source:hendershott-menkveld-2014"
        ],
        "origin_summary": "Seeded from primary research on intermediary inventory and price pressure.",
        "captured_at": "2026-08-31T00:00:00Z"
      },
      "title": "Intermediary inventory pressure and mean reversion",
      "generation_modes": [
        "CONSTRAINT_FIRST",
        "MICROSTRUCTURE_STATE",
        "LITERATURE_REPLICATION"
      ],
      "mechanism_family": "Risk-bearing intermediation",
      "mechanism_summary": "Risk-averse intermediaries absorb asynchronous investor demand and use temporary price concessions to attract offsetting flow and mean-revert inventory.",
      "market_scopes": [
        "EQUITIES",
        "FUTURES",
        "OPTIONS",